Fecha,Operación,Detalles
2024-06-23T22:46:14.133919,Compra de accesorio,"Tipo de animal: perro, Accesorio: Collar, Cantidad: 1"
2024-06-23T22:47:15.497365,Compra de juguete,"Tipo de animal: Perro, Juguete: Pelota"
2024-06-23T22:47:20.183464,Compra de accesorio,"Tipo de animal: perro, Accesorio: Correa, Cantidad: 1"
2024-06-24T23:32:38.851450,Compra de juguete,"Tipo de animal: Conejo, Juguete: Zanahoria de juguete"
2024-06-24T23:42:59.217025,Compra de comida,"Marca: Ricocan, Tipo: Perro, Edad: Cachorro, Cantidad: 1kg"
2024-06-24T23:45:40.665093,Compra de comida,"Marca: ReptoMin, Tipo: Tortuga, Edad: Adulto, Cantidad: 7kg"
